{
  "pattern_name": "hero-product-proof-shell",
  "category": "layout",
  "description": "Combine a short, dominant value proposition with immediate product, workflow, or inventory proof in the first viewport or just below it.",
  "observed_on": [
    "railway",
    "notion-product",
    "posthog",
    "airbnb"
  ],
  "applies_to": [
    "developer-tool-modern",
    "product-ui-system",
    "marketplace-system"
  ],
  "transferability": "universal",
  "implementation_cost": "medium",
  "ux_value": "high",
  "a11y_risk": "low",
  "performance_risk": "medium",
  "evidence_notes": [
    "Railway pairs the hero promise with an overlapping product canvas.",
    "Notion opens with a short workspace promise and immediate product-media follow-up.",
    "PostHog frames the hero as a developer-native product surface.",
    "Airbnb puts the search shell at the center of the first screen."
  ],
  "rules": [
    "Place the primary user task or product value in the first screen.",
    "Support the hero with concrete product proof rather than abstract decoration alone.",
    "Keep the proof asset large enough to feel trustworthy and legible."
  ],
  "implementation_notes": [
    "Use a centered hero stack with a product shell, search shell, or workflow demo anchored directly below the main copy.",
    "On mobile, preserve the same proof concept but simplify the shell and reduce screenshot density.",
    "Treat screenshots and hero art as the likely main payloads and optimize them first."
  ],
  "avoid_when": [
    "The product has no credible visual proof yet.",
    "The proof asset would be unreadable at the target viewport sizes.",
    "The hero becomes visually overloaded by combining too many demo states at once."
  ]
}
