{
  "pattern_name": "trust-metrics-strip",
  "category": "component",
  "description": "Use a compact band of metrics, customer counts, stars, contributors, deploys, or rankings to reinforce credibility after the core product story is established.",
  "observed_on": [
    "railway",
    "voidzero",
    "notion-product"
  ],
  "applies_to": [
    "developer-tool-modern",
    "product-ui-system",
    "minimal-saas-clarity"
  ],
  "transferability": "universal",
  "implementation_cost": "easy",
  "ux_value": "medium",
  "a11y_risk": "low",
  "performance_risk": "low",
  "evidence_notes": [
    "Railway uses large platform counters and deploy totals.",
    "VoidZero uses downloads, stars, and contributor counts.",
    "Notion reinforces scale and adoption through rankings and usage signals."
  ],
  "rules": [
    "Place metrics after the core value proposition, not before it.",
    "Choose proof numbers that the audience can interpret quickly.",
    "Keep visual treatment simple so numbers feel credible."
  ],
  "implementation_notes": [
    "Render as a small grid or strip with strong labels and one short supporting explanation.",
    "Avoid over-animating counters; instant or subtle updates are usually enough.",
    "Validate live-data fallbacks so users never see zeroed or broken proof states."
  ],
  "avoid_when": [
    "The proof numbers are weak, stale, or not actually meaningful to the buyer.",
    "The metric strip appears before the user understands the product.",
    "The data source is unreliable or likely to fail at render time."
  ]
}
